{
  "naics": "561510",
  "run_id": "2026-07-21_gpt-5.6-sol_v312r2_561510",
  "artifact_digests": {
    "packet_sha256": "ffdfbda521ebe8db913b33a5fd7e550554be21685f0f2816beaff3b81ea69fad",
    "run_sha256": "1cda0c07ef6132b715b8118cd3c099e49387f7408dab310a46d8fbb956dc0b22",
    "memo_sha256": "f8182dc7c52f6d587c7bd60644127c44f83f6576488785de9fa0afcef994cbc7"
  },
  "review_meta": {
    "model_id": "gpt-5.6-sol",
    "review_date": "2026-07-21",
    "prompt_version": "validator-3.1.2"
  },
  "outcome": "publishable_with_caveats",
  "mechanics": {
    "schema_valid": true,
    "identity_valid": true,
    "model_route_valid": true,
    "dataset_equal": true,
    "finalization_equal": true,
    "memo_equal": true,
    "arithmetic_valid": true
  },
  "source_reviews": [
    {
      "source_id": "S1",
      "url": "https://www.census.gov/naics/reference_files_tools/2022_NAICS_Manual.pdf",
      "accessible": true,
      "score_driving": false,
      "support": "not_score_driving",
      "notes": "The Census manual directly supports the stated 561510 industry definition and the exclusions for tour operators and stand-alone reservation services."
    },
    {
      "source_id": "S2",
      "url": "https://www.travelweekly.com/Travel-News/Travel-Agent-Issues/Travel-Industry-Survey-2025-attitudes-toward-technology",
      "accessible": true,
      "score_driving": true,
      "support": "partially_supported",
      "notes": "The page supports 59% any-AI use, marketing as the leading owner/manager use, itinerary interest, accuracy and personal-touch concerns, and gradual NDC diffusion. It does not directly measure role replaceability, effective adoption, or t50; those are transparently labeled estimates with ranges and caveats."
    },
    {
      "source_id": "S3",
      "url": "https://www.phocuswright.com/Travel-Research/Research-Updates/2025/5-ways-autonomous-ai-agents-will-redefine-travel",
      "accessible": true,
      "score_driving": true,
      "support": "partially_supported",
      "notes": "The page supports 40% traveler interest in booking trip components through AI and an expected shift of intent and some bookings into generative interfaces. The selected 2.5-year t50 is a disclosed estimate rather than a reported measurement."
    },
    {
      "source_id": "S4",
      "url": "https://www2.arccorp.com/about-us/newsroom/2025-news-releases/december-2024-ticket-sales/",
      "accessible": true,
      "score_driving": false,
      "support": "not_score_driving",
      "notes": "ARC directly reports $99.2 billion of 2024 U.S. agency air-ticket sales, 4% growth, a record annual total, and the 10,305-location scope stated in the packet."
    },
    {
      "source_id": "S5",
      "url": "https://www.travelweekly.com/Industry-Survey-2025",
      "accessible": true,
      "score_driving": true,
      "support": "partially_supported",
      "notes": "The survey page directly reports 1,562 unweighted respondents, 56% older than 55, 71% owners or managers, and 67% home-based independent contractors or agencies. It does not provide an owner-by-age cross-tab or a 60-plus rate; the 0.40 selection is explicitly an estimate with LOW confidence, a 0.25-0.55 range, and the exact limitation disclosed."
    },
    {
      "source_id": "S7",
      "url": "https://www.travelweekly.com/Travel-News/Travel-Agent-Issues/2025-year-in-review",
      "accessible": true,
      "score_driving": true,
      "support": "supported",
      "notes": "The page describes a 2025 consolidation wave and identifies four distinct acquiring groups: Amex GBT, Direct Travel, Trevello, and KHM Travel Group. The packet expressly caveats that two transactions are very large TMC deals rather than direct target-band comparables."
    },
    {
      "source_id": "S8",
      "url": "https://ctacquisitions.com/sell-your-business/travel-agency/",
      "accessible": true,
      "score_driving": true,
      "support": "supported",
      "notes": "The specialist-broker page supports commission, override, fee, host, accreditation and transferability mechanics; it states roughly 4-6x EBITDA for established $3-15 million revenue agencies and 6-8x for larger platforms. The source type and comparability limits are disclosed, although the live page title differs from the registered title."
    },
    {
      "source_id": "S9",
      "url": "https://www.gao.gov/assets/a239238.html",
      "accessible": true,
      "score_driving": true,
      "support": "supported",
      "notes": "GAO-03-749 directly reports that average annual airline payments to travel agencies fell 57% from 1999 to 2002 as published base commissions ended and privately negotiated arrangements remained, supporting the historical capture and channel-reset analogue."
    },
    {
      "source_id": "S10",
      "url": "https://www.phocuswire.com/booking-travel-advisors-inflation-phocuswright-research",
      "accessible": true,
      "score_driving": true,
      "support": "supported",
      "notes": "The page states that 2025 travel-agency sales outpaced the broader travel market and that advisor clients prioritize personal relationships, customer service, and product or destination knowledge rather than lowest price, supporting the directional moat and terminal-demand claims."
    }
  ],
  "findings": [
    {
      "severity": "caveat",
      "category": "metadata",
      "input_paths": [
        "sources.S8.title"
      ],
      "explanation": "The live S8 page title is 'Sell Your Travel Agency Business (2026): Buyer-Paid Process | CT Acquisitions,' while the registry records 'Sell Your Travel Agency Business: Valuation and Buyer Guide.' The URL and relevant supporting content remain intact.",
      "materiality": "This is a non-material page-title variant and does not change support for pricing structure, transferability, or the cited multiple ranges, so it cannot change C, M, B, S, or the thesis.",
      "remediation": "At the next versioned source refresh, align the registered page title with the live title while preserving the existing artifact unchanged.",
      "publication_caveat": "S8's live page title differs from the registered title, but the URL and supporting broker content remain accessible and substantively aligned."
    }
  ],
  "publication_caveats": [
    "inputs.ai_replaceable_share: The 4-digit OEWS mix includes OTAs and other 5615 employers, so the software-developer share overstates many midmarket agencies.",
    "inputs.ai_replaceable_share: The 37.87% residual contains mixed occupations; treating it as predominantly administrative is a material judgment.",
    "inputs.ai_replaceable_share: Independent-contractor advisors are outside the W-2 wage weights, so this is not a share of total economic labor used by host agencies.",
    "inputs.pi_dist: No representative source measures pass-through of AI savings for U.S. midmarket agencies; this is a mechanism-based estimate.",
    "inputs.pi_moat: Moat varies sharply between corporate/luxury/group specialists and commodity leisure agencies.",
    "inputs.t50_years: Tool-use surveys are not measurements of labor-displacing effective adoption, so the bridge to t50 is uncertain.",
    "inputs.current_adoption_pct: The 1,562-response survey was unweighted and covers advisors across agency sizes, not only $1-10 million EBITDA operators.",
    "inputs.historical_analogs: Generative agents combine consumer-interface and labor-automation effects, so the internet-era analogue is directional rather than identical.",
    "inputs.owners_60plus_pct: The survey does not publish the owner-by-age cross-tab, uses a 55+ threshold and is not statistically weighted; this is not an observed owner-60+ rate.",
    "inputs.owners_60plus_pct.succession_shortage_documented: Absence of qualifying ownership-succession evidence does not prove succession is easy; it means the favorable factor-B boolean is not awarded.",
    "inputs.active_consolidators: Two transactions involve very large TMCs and are not direct $1-10 million EBITDA comparables.",
    "inputs.buy_mult: Broker guidance is not a disclosed transaction dataset; agencies often quote SDE or commission multiples and gross-versus-net revenue can change the apparent size band.",
    "inputs.exit_mult: Exit assumes the platform crosses a quality and scale threshold; AI disintermediation or advisor churn could instead compress the multiple.",
    "inputs.pricing_structure: Revenue presentation varies between gross bookings and net commissions, so peer margins and multiples require normalization.",
    "S8's live page title differs from the registered title, but the URL and supporting broker content remain accessible and substantively aligned."
  ],
  "summary": "Publishable with caveats. Exact identity, schema, route, dataset injection, arithmetic, manifest digests, fresh finalization, and fresh memo rendering all pass. All nine registered sources were reopened; the seven score-driving sources support the stated observations or transparently disclosed estimates. Factor-B succession semantics are correct: succession_shortage_documented=false contributes no +0.1 ownership-wave increment, and no advisor-labor evidence is reused as a succession proxy. Factor B remains sensitive to the explicitly LOW-confidence 0.40 owner-age estimate and broad buyer comparables, both already preserved as publication caveats. No material research defect, reversed factor semantics, or capture/terminal double counting was found."
}
