{
  "naics": "561710",
  "run_id": "2026-07-21_gpt-5.6-sol_v312g1_561710",
  "artifact_digests": {
    "packet_sha256": "2bbffb091b9c168f3429e9496477d35c9b30dec84335571fafa9e02f3fc4fb96",
    "run_sha256": "4a24c1aabb1d46570aaf16e4d7face98053dac326e014f28e78b57ac6a9b29e6",
    "memo_sha256": "23ee5265e759978a9062b6b555b9710937fbbdecda67f5b3570d6d40b2c25348"
  },
  "review_meta": {
    "model_id": "gpt-5.6-sol",
    "review_date": "2026-07-21",
    "prompt_version": "validator-3.1.2"
  },
  "outcome": "publishable_with_caveats",
  "mechanics": {
    "schema_valid": true,
    "identity_valid": true,
    "model_route_valid": true,
    "dataset_equal": true,
    "finalization_equal": true,
    "memo_equal": true,
    "arithmetic_valid": true
  },
  "source_reviews": [
    {
      "source_id": "S1",
      "url": "https://www.census.gov/naics/reference_files_tools/2022_NAICS_Manual.pdf",
      "accessible": true,
      "score_driving": false,
      "support": "not_score_driving",
      "notes": "The Census definition confirms the exact six-digit structural-pest scope, inclusion of fumigation, and exclusion of crop and forestry pest control."
    },
    {
      "source_id": "S2",
      "url": "https://www.fieldroutes.com/blog/pest-control-industry-insights-report",
      "accessible": true,
      "score_driving": true,
      "support": "supported",
      "notes": "The page identifies a Thrive Analytics survey of 1,025 pest-company leaders and reports 73% not using AI for business performance in 2025 versus 82% in 2024; the packet appropriately caveats vendor sponsorship and the gap between any use and effective labor substitution."
    },
    {
      "source_id": "S3",
      "url": "https://www.rollins.com/investors/financial-information/sec-filings/content/0000084839-26-000008/rol-20251231.htm",
      "accessible": true,
      "score_driving": true,
      "support": "supported",
      "notes": "The 2025 filing supports the 75% recurring mix, recurring contract cadence, continued demand, and 94 acquisitions over three years including 26 in 2025. The packet discloses that Rollins is a scaled-company proxy for smaller targets."
    },
    {
      "source_id": "S4",
      "url": "https://firstpagesage.com/business/ebitda-multiples-for-pest-control-companies/",
      "accessible": true,
      "score_driving": true,
      "support": "supported",
      "notes": "The Q1 2025 table directly reports 6.8x commercial and 6.9x residential EBITDA for the $1-5 million band and 8.2x/8.3x for the $5-10 million band. The packet retains the source's undisclosed-sample and target-mix limitations."
    },
    {
      "source_id": "S5",
      "url": "https://ctacquisitions.com/guides/succession-cliff-report-2026/",
      "accessible": true,
      "score_driving": true,
      "support": "supported",
      "notes": "The report gives 49.5% age 55+ for broad NAICS sector 56 and expressly limits its granularity; the packet's 35% age-60+ selection is labeled a low-quality estimate and a non-pest-specific transformation."
    },
    {
      "source_id": "S6",
      "url": "https://www.pctonline.com/news/pct-announces-annual-top-100-list/",
      "accessible": true,
      "score_driving": true,
      "support": "partially_supported",
      "notes": "The current PCT item confirms the 2025 Top 100 context and continuing private-equity attention, but does not by itself enumerate eight active buyers. The exact named-buyer support comes from S7 and current Rollins activity from S3, while the packet caveats the age of the named list."
    },
    {
      "source_id": "S7",
      "url": "https://www.pctonline.com/article/pest-management-all-grown-up/",
      "accessible": true,
      "score_driving": true,
      "support": "supported",
      "notes": "The article names Rollins, Terminix, Massey, Arrow, Truly Nolen, Rentokil, Anticimex, and Certus in acquisition activity and documents the industry's long transition to cloud routing, mobile records, payments, and electronic documentation."
    },
    {
      "source_id": "S8",
      "url": "https://www.epa.gov/pesticide-worker-safety/federal-certification-standards-pesticide-applicators",
      "accessible": true,
      "score_driving": true,
      "support": "supported",
      "notes": "EPA confirms certification for people applying or supervising restricted-use pesticides and includes structural and health-related pest control among commercial categories. The packet correctly avoids treating this as universal licensing of every task."
    },
    {
      "source_id": "S9",
      "url": "https://www.target-specialty.com/blog/remote-rodent-monitoring-benefits/",
      "accessible": true,
      "score_driving": false,
      "support": "not_score_driving",
      "notes": "The vendor page supports reduced empty-trap checking and faster servicing for connected rodent devices; it is used only as a disclosed terminal-demand and visit-frequency risk rather than as a scored automation input."
    }
  ],
  "findings": [],
  "publication_caveats": [
    "inputs.ai_replaceable_share: AI adoption evidence covers company use, not measured task-level labor displacement.",
    "inputs.ai_replaceable_share: EPA certification applies to restricted-use pesticides, not every pest-control task; it supports a human floor but is not a universal licensing claim.",
    "inputs.ai_replaceable_share: Remote monitoring can reduce field labor on some commercial rodent accounts; that demand effect is not used to inflate role automation.",
    "inputs.pi_dist: Rollins is a scaled public operator, so its contract mix and pricing discipline may overstate retention at independent targets.",
    "inputs.pi_moat: Moat is strongest in dense recurring and compliance-heavy commercial routes and weakest in one-time residential work.",
    "inputs.t50_years: Company use is broader than effective adoption of labor-replacing workflows, so extrapolating the recent one-year change would be too aggressive.",
    "inputs.current_adoption_pct: Vendor-sponsored company survey; any AI use does not necessarily imply material effective adoption or headcount substitution.",
    "inputs.historical_analogs: Legacy routing adoption is not identical to autonomous customer-service or back-office AI.",
    "inputs.owners_60plus_pct: This is a sector-56, age-55+ Census-based proxy transformed to age 60+, not a direct 561710 observation.",
    "inputs.owners_60plus_pct.succession_shortage_documented: Absence of sufficiently specific reopened evidence is not evidence that succession shortages do not exist.",
    "inputs.active_consolidators: The named-buyer list is partly from 2021; current activity is confirmed for the market and Rollins, not individually reverified for every named group.",
    "inputs.buy_mult: The compilation does not disclose transaction count or deal-level observations; exact mix, recurring share, owner dependence and geography matter.",
    "inputs.buy_mult: Normalize owner compensation: subscale market quotes may be SDE rather than EBITDA.",
    "inputs.exit_mult: Exit multiple expansion requires actual scale, retention and route density; market compression can eliminate it.",
    "inputs.exit_mult: The same undisclosed-sample limitation affects both buy and exit benchmarks.",
    "inputs.pricing_structure: Rollins' 75% recurring mix is a scaled-company benchmark, not an industry-wide observed average."
  ],
  "summary": "All deterministic mechanics and exact-artifact checks pass. The reopened sources support the direction of the pest-control thesis and its score-driving numeric anchors, with no material evidence, rubric-direction, capture/terminal, or double-counting defect. Publication remains caveated because the packet intentionally relies on disclosed vendor, scaled-company, broad-sector, older buyer-list, and undisclosed-transaction-sample proxies."
}
