{
  "naics": "238220",
  "run_id": "2026-07-21_gpt-5.6-sol_v312g1_238220",
  "artifact_digests": {
    "packet_sha256": "bba30213e51f2492b47f32df3bcf4f7227a9b3329001e45fda0a958c9f15d71f",
    "run_sha256": "d0d44d0ee3a9d3ecc23fbe4a0ddbe627aa4f845c6478e57334c274a66712c1f7",
    "memo_sha256": "06c38eec5f8aa1d75f15b1ef9010561f5f3fcb2791c6a0d0ef0bd553a8c15982"
  },
  "review_meta": {
    "model_id": "gpt-5.6-sol",
    "review_date": "2026-07-21",
    "prompt_version": "validator-3.1.2"
  },
  "outcome": "publishable_with_caveats",
  "mechanics": {
    "schema_valid": true,
    "identity_valid": true,
    "model_route_valid": true,
    "dataset_equal": true,
    "finalization_equal": true,
    "memo_equal": true,
    "arithmetic_valid": true
  },
  "source_reviews": [
    {
      "source_id": "S1",
      "url": "https://www.servicetitan.com/press/ai-in-the-skilled-trades-report-2025",
      "accessible": true,
      "score_driving": true,
      "support": "partially_supported",
      "notes": "ServiceTitan directly reports the 46%, 59%, 51%, and 39% survey figures and embedded-software adoption path. The source itself says its cross-trade vendor-sponsored sample is not representative, so the 30% effective-adoption selection remains a disclosed estimate."
    },
    {
      "source_id": "S2",
      "url": "https://www.epa.gov/section608/section-608-technician-certification",
      "accessible": true,
      "score_driving": true,
      "support": "supported",
      "notes": "EPA directly supports the certification requirement for technicians maintaining, servicing, repairing, or disposing of covered refrigerant equipment and the durable physical-work direction."
    },
    {
      "source_id": "S3",
      "url": "https://www.bizbuysell.com/learning-center/valuation-benchmarks/hvac/",
      "accessible": true,
      "score_driving": true,
      "support": "supported",
      "notes": "BizBuySell supports the five-year 2.75x average owner-earnings multiple, seller-discretionary-earnings basis, and much smaller median deal scale used only as a cross-check."
    },
    {
      "source_id": "S4",
      "url": "https://western-companies.com/wp-content/uploads/2026/02/HVAC-Plumbing-Services-MA-Report-February-2026.pdf",
      "accessible": true,
      "score_driving": true,
      "support": "partially_supported",
      "notes": "The report states 8.4x and 9.9x residential and 7.6x and 8.8x commercial size-tier multiples. It also labels the ranges illustrative, directional, adapted, and partly based on proprietary observations, matching the authored caveat."
    },
    {
      "source_id": "S5",
      "url": "https://www.capstonepartners.com/wp-content/uploads/2025/12/Capstone-Partners_HVAC-Services_MA-Coverage-Report_December-2025.pdf",
      "accessible": true,
      "score_driving": true,
      "support": "supported",
      "notes": "Capstone directly reports 149 YTD 2025 transactions and identifies multiple recent HVAC-services acquirers and platforms, supporting the conservative active-buyer floor and market-activity direction."
    },
    {
      "source_id": "S6",
      "url": "https://hardinet.org/posts/market-intelligence/voice-of-contractor-highlight-hvacr-contractors-are-getting-younger",
      "accessible": true,
      "score_driving": true,
      "support": "partially_supported",
      "notes": "HARDI reports 30% of respondents age 55-64, 23% over 65, and that 61% were owners or executives. It does not directly report an exact-code owner age-60-plus share."
    },
    {
      "source_id": "S7",
      "url": "https://fmicorp.com/about/news/fmi-releases-2024-study-on-ownership-transfer-and-management-succession",
      "accessible": true,
      "score_driving": true,
      "support": "partially_supported",
      "notes": "FMI directly reports a broad engineering/construction ownership-transition gap, including 58% without a plan and half of near-term exiting owners without one, but it is not exact-code plumbing/HVAC evidence."
    },
    {
      "source_id": "S8",
      "url": "https://www.servicetitan.com/templates/hvac/price-list",
      "accessible": true,
      "score_driving": true,
      "support": "partially_supported",
      "notes": "ServiceTitan states that flat-rate pricing dominates among the HVAC contractors it supports and documents pricebook, estimate, invoicing, and AI workflow features. It is vendor evidence, not a revenue-weighted exact-NAICS pricing survey."
    },
    {
      "source_id": "S9",
      "url": "https://www.phccweb.org/news/phcc-releases-2026-industry-environmental-scan-highlighting-key-trends-and-opportunities/",
      "accessible": true,
      "score_driving": true,
      "support": "partially_supported",
      "notes": "PHCC directly reports skilled-talent demand caused by retirements and a tight worker pipeline across plumbing and HVACR. It supports workforce scarcity, not an exact-code owner-succession shortage by itself."
    }
  ],
  "findings": [
    {
      "severity": "caveat",
      "category": "numeric_support",
      "input_paths": [
        "inputs.owners_60plus_pct"
      ],
      "explanation": "HARDI reports 30% of respondents age 55-64 and 23% over 65, but it does not report the selected 42% age-60-plus value. A uniform split of the 55-64 band would imply about 38%; 42% requires an additional within-band age-distribution judgment.",
      "materiality": "The estimate can move the buyability factor, but it is explicitly classified as a low-confidence estimate with a 28%-53% range that contains both 38% and 42%. This does not reverse factor direction or change the artifact's factor-floor kill conclusion.",
      "remediation": "For a future refresh, use exact-code owner-age microdata or state the within-band age-distribution assumption explicitly; retain the current estimate only with the caveat.",
      "publication_caveat": "inputs.owners_60plus_pct: The selected 42% is a judgmental interpolation rather than a source-reported statistic; a uniform split of HARDI's 55-64 band would imply about 38%, and the survey mixes owners/executives with other contractor respondents."
    }
  ],
  "publication_caveats": [
    "inputs.ai_replaceable_share: The role mix is at five-digit 23822 rather than exact 238220 and leaves a 26.49% residual whose composition is uncertain.",
    "inputs.ai_replaceable_share: Vendor survey use cases indicate task direction, not measured labor displacement.",
    "inputs.pi_dist: The value assumes a residential/light-commercial service-heavy operator; commercial construction would be lower.",
    "inputs.pi_moat: Licensing supports service availability and demand but is not treated as a complete barrier to price competition.",
    "inputs.t50_years: Survey usage is cross-trade and includes experimentation rather than scaled labor removal.",
    "inputs.current_adoption_pct: Vendor-sponsored survey of multiple residential and commercial trades is not representative of exact NAICS 238220.",
    "inputs.historical_analogs: The analogue is qualitative and does not identify a causal labor-reduction rate.",
    "inputs.owners_60plus_pct: HARDI survey respondents are contractors/purchasing decision-makers, not a probability sample of exact-code firm owners; plumbing coverage is incomplete.",
    "inputs.owners_60plus_pct.succession_shortage_documented: FMI covers the broader built environment and PHCC's shortage statement concerns skilled talent, so the exact-code owner-succession bridge is a disclosed proxy.",
    "inputs.active_consolidators: The count is a documented minimum, not a census, and includes commercial HVAC as well as residential home services.",
    "inputs.buy_mult: Western's table is illustrative and partly synthesized; BizBuySell is SDE, mostly below the target EBITDA band, and is not converted into EBITDA.",
    "inputs.exit_mult: Achieving the selected exit requires mix and quality improvement; deal structures and market rates can reduce realized cash value.",
    "inputs.pricing_structure: No exact-NAICS revenue-weighted pricing-model survey was located; plumbing and commercial-mechanical mixes may differ.",
    "inputs.owners_60plus_pct: The selected 42% is a judgmental interpolation rather than a source-reported statistic; a uniform split of HARDI's 55-64 band would imply about 38%, and the survey mixes owners/executives with other contractor respondents."
  ],
  "summary": "Mechanics, exact identity, frozen digests, dataset injection, arithmetic, finalization, and memo rendering all pass. All nine registered score-driving sources resolve and support the cited facts or the disclosed direction of estimate inputs. The conclusion remains useful; the additional owner-age interpolation issue is non-fatal because the selected value is an explicit low-confidence estimate within a broad range and cannot change the factor-floor kill conclusion."
}
